pageid,title,text,language,category,type,url,token_count,page_id,detected_languages,is_multilingual,main_category,source_type
,"Ооржак, Лориса Бүрбү кызы","Лориса Бүрбү уруу Ооржак (орус. Лариса Бюрбюевна Ооржак англ. Lorisa Bүrbү uruu Oorzhak ) - Россияның хостуг хүреште тыва алдарлыг спортсмени. Өвүр кожууннуң Хандагайты суурунга 1985 чылда 8 айның 10-да төруттунген. Он харлыындан эгелеп, хостуг хүреш секциязынга кирип, хүрежип эгелей берген. Хандагайты ортумак школазын дооскан, Тываның күрүне университединиң студентизи. Ооржак Лариса бичии болгаш аныяк уруглар аразында Россия Федерациязының бирги чери дээш болган маргылдааларның хөй дакпыр тиилекчизи. Улуг улус аразынга Россияның 2004ч. чемпиону. Аныяктар аразынга делегейниң бир болгаш Европаның үш дакпыр чемпиону. Делегей чергелиг спорт мастери, Тываның алдарлыг ажылдакчызы. Ооң адын ""Тыванын XX чүс чылда алдарлыг кижилери"" деп Күрүне номунче киирген. Афины хоорайга болган Олимпий оюннарының киржикчизи. == Спорт-дешпилде == Он харлыындан эгелеп, хостуг хүреш секциязынга кирип, хүрежип эгелей берген. Хандагайты ортумак школазын дооскан, Тываның күрүне университединиң студентизи. Ооржак Лариса бичии болгаш аныяк уруглар аразында Россия Федерациязының бирги чери дээш болган маргылдааларның хөй дакпыр тиилекчизи. Улуг улус аразынга Россияның 2004 чылда чемпиону. Аныяктар аразынга делегейниң бир болгаш Европаның үш дакпыр чемпиону. == Ат-алдар == Европанның үш дакпыр чемпиону, делегей чергелиг маргылдааларга ийи катап ийиги черниң ээлекчизи, Россияның чемпиону. Делегей чергелиг спорт мастери, Тываның алдарлыг ажылдакчызы. Афины хоорайга болган Олимпий оюннарының киржикчизи. Ооң адын ""Тыванын XX чүс чылда алдарлыг кижилери"" деп Күрүне номунче киирген. == Дурт-сын == Узуну - 149 см, кили - 48 кг. == Чедиишкиннери == Россияның чыынды командазы дээш, 2003 чылдан эгелеп маргылдааларга киржип келген. 2004 чылда Афины хоорайга эрткен Олимпиаданың киржикчизи. 2007 чылдың апрель 21-де айыылга таварышкаш, бир бүүрек чок арткаш, эмнелгеге үр чыткан. 2008 чылда чайын улуг спортче дедир эглип келген. 2009 чылда Россияның чемпиону болгаш делегейниң вице-чемпиону. == Дөзү == ""Тыванын XX чүс чылда алдарлыг кижилери"" деп Күрүне ному.",tyv,Спорт (Sous-catégorie),,https://tyv.wikipedia.org/?curid=357,292,357.0,['ru'],False,Спорт,Sous-catégorie
,"Доңгак, Бегзи-Хуурак","Доңгак, Бегзи-Хуурак - Тываның алдарлыг мөгези, Ада-чурт Дайынның киржикчизи (гвардейжи улуг сержант). Улуг-Хем кожуунда Хендерге сумузунга 1919 чылда төрүттүнген. Тыва Арат Республиканың Наадымнарының 128 мөге киржип турган хүрештеринге 1942-1943 чылдарда ийи улай тергиидеп үнген. ""ТАР-нын Начын мөгези"" деп аттың эдилекчизи. Ооң адын ""Тыванын XX чүс чылда алдарлыг кижилери"" деп Күрүне номунче киирген. Ол Тываның аъттыг шерииниң дайынчызы тургаш, 1943 чылда Делегейниң ийиги дайынынче аъттаныпкан тыва эки турачыларның бирээзи болган. Тываның алдарлыг мөгези Доңгак Бегзи-Хуурак улуг дайынга база алдарлыг тиилелгелерни чедип алгаш, ээп чанып келген. Дайынга эрес-маадырлыг чоруу дээш ""Алдар"" ордениниң III чергези, Ада-чурт Дайыны ордениң I болгаш II чергелери база хөй-хөй медальдар-биле ол шаңнаткан. Гвардейжи улуг сержант чанып келгеш, ам автономнуг область апарган Тывазының Наадымнарынга катап киржип эгелээн. Ол 1947, 1948 чылдарда, кымга-даа октатпайн, база катап шүглүп үнген. == Дөс == ""Тыванын XX чүс чылда алдарлыг кижилери"" деп Күрүне ному.",tyv,Спорт (Sous-catégorie),,https://tyv.wikipedia.org/?curid=201,140,201.0,['ru'],False,Спорт,Sous-catégorie
,"Монгуш,Чанман Балчынмай оглу","Чанман Балчынмай оглу Моңгуш - лама-башкы эртемниг мөге. Чаа-Хөл кожуунунуң Ак-Туруг сумузунга төрүттүнген. == Намдар == Лама-башкы эртемниг. Хүн-ноян Буян-Бадыргының мөгези. Моол күрүнениң байырлалдарынга ийи катап, Тываның барыын талакы кожууннарының Чадаанага болуп турган Наадымнарынга үш улаштыр шүүлгеш, ""Улустуң Чааны"" деп атты чедип алган. Тыва Арат Республика тургустунган соонда, Чазак байырлалдарынга 1921-1923 чылдарда улаштыр тиилелгени чедип ап, ""Улустуң Чааны"" деп хүндүлүг адын бадыткаан.",tyv,Спорт (Sous-catégorie),,https://tyv.wikipedia.org/?curid=313,65,313.0,['ru'],False,Спорт,Sous-catégorie
,"Кара-Сал, Павел Сурат оглу","Кара-Сал, Павел Сурат оглу (азы Кара-Сал Павел Суратович) (1953 чылда Сүт-Хөл кожуунуң Ак-Даш суурга төр.) - тыва мөге, РСФСР-ң спорт мастери, Тываның бир төречизи, Дээди Хуралдың комитет даргазы турган. == Чедиишкиннери == Хөй дакпыр тыва хүрешке база Тыва АССР-ң Сибирь болгаш Ыраккы Чөөн чүк спартакиадазынга тиилекчизи база аңаа шаңналдыг черлерже кирип турган. Павел Кара-Сал сураглыг мөгелер аразындан база бир билдингир удуртукчу, поликтик чораан кижи. Ол Сүмбер-Уула колхозтуң тургузукчузу болгаш удуртукчузу; Шамбалыг совхозтуң директору, көдээ ажыл-агый сайыдының оралакчызы болгаш Дээди Хуралдың комитет даргазы болуп ажылдап чораан. Павел Кара-Сал Тыва Республиканың сайзыралынга бодунуң улуг үлүг-хуузун киирген. Тыва Республиканың Арзылаң Мөгези Седен-Очур Кара-Салдың адазы. Павел Кара-Салдың база хөй саныг мөгелерниң саналы-биле: ""Хүреш"" - эр кижиниң бодун хынарының эң-не эки аргазы-дыр. Чүге дээрге ""хүреш"" - арыг демисел-дир, ында кандыг-даа дузалал херексел негеттимейн турар. Бөмбүк-даа, четки-даа, хол хаптары-даа чок, деңзи-даа барымдаалавайн, үе-шак, девискээр-биле-даа кызыгаарлаттымайн турар. Команда дээш эш-өөр-даа турбас. Чүгле ийи эр кижи - оларның иелериниң төрүп берген күш-шыдалы бар. Хүреш күш-шыдалдың, арга-мергежилдиң, могап-шылавазының ёзулуг хыналдазы. Ол спорттуң эң тулган хевири. Ындыг болганда, хүрешке дүрүм-хоойлу эвээш болган тудум-на, хүреш солун, көрүштүг болур. == Дөзүк == ""ВКонтактеден"" арын",tyv,Спорт (Sous-catégorie),,https://tyv.wikipedia.org/?curid=3135,182,3135.0,['ru'],False,Спорт,Sous-catégorie
,Наадым,"Наадым - Тыва Республиканың малчыннарның чыыжы болгаш байырлалы. Наадым байырлалы чылдың-на болуп эртип турар. Байырлалды эгезинде кожууннар аразынга эртирер, адак сөөлүнде республика чергелиг байырлал болур. Болур үези: июль-сентябрь. Байырлалдың албан кезектери: хүреш, аът чарыжы, ча адары. == Байырлал дугайында == Наадым байырлалының болур хүнүн чылдың-на Тыва Республиканың Чазааның бадылаашкыны-биле илередир. Болур черин чыыштың республикада эртирип турар комитеди (оргкомитет) бадылаар. Байырлалды эртирип турар кол утказы болза, Тываның кол ажыл-ишчи чону - малчыннарны алгап-мактап, шаңнаары болгаш бүгү чылда кылган үүле-херээн демдеглээри бооп турар. Малчыннарның национал байырлалынга албан болур мөөрейлери: хүреш, аът чарыжы, ча адары, тергиин эки өгнү илередири, эң эки национал көстүүмнү илередири болгаш аътарны каастаары. Наадым каш хонук ишти болуп эртип турар. Ук байырлалды Тывага 1922 чылдан тура-ла, Тыва Арат Республиканың тургустунганындан бээр, демдеглеп эгелей берген. Тываның Совет эвилелинге турганында байырлалды эртирерин хоруп каапкаш турган, 1993 чылда байырлалды катап эгиткен. 2007 чылдан тура Тываның Чазааның шииткели-биле кожууннар аразынга республика чергелиг Наадымны бодунуң кожуунунга эртирерин чаалап алыр мөөрей эртирип эгелээн. == Хүреш == Ук чүүл дараазында арында: Хүреш. Демдеглелдиг Хүреш-2014 дугайында: ""Хүреш"" стадиону Тыва Республиканың тулган дээн 310 мөгелериниң аразындан Тиилекчини илередири-биле Наадымның аалчыларын чыган. Ол чылын Наадым болза Тыва биле Россияның демнежилгезиниң 100 чыл ою кылдыр дакпырлажып келгени-биле, Хүреш-2014 болза ""100 чылдың Хүрежи"" кылдыр база адатынып турар. Тиилээн мөге болза «Тыва Республиканың Арзылаң Мөгези» Түлүш Сайын-Белек (Тес-Хем кожууну). Сайын-Белек Тываның эң хүндүткелдиг болгаш күштүг мөгелерин боду шүүп үнүп тиилээн. Наадымда шүглүп чораан мөгелерниң даңзызы. == Аът чарыжы == Наадымның база бир көрүштүг маргылдааларның бирээзи - аът чарыжы. Аңаа аъттарның күш-шыдалын болгаш дүргенин хынаар. Аъттарның назы-харының аайы-биле чаржыр оруунуң узуну аңгы-аңгы - 15-тен 40 километр чедир. Аът мунукчулары 5 хардан 13 хар чедир назылыг уруглар. Шаңналды аъттың мунукчуларынга болгаш ээлеринге тыпсыр. Бирги черлерни ээлээн аъттарның аразындан эң дүрген болган аът ""чүгүрүк-доруг"" деп атты алыр, арткан тиилекчилер ""Сыын-Кара"", ""Чүгүрүк-Сарала"", ""Эзир-Кара"" болгаш оон-даа өске аттарны алыр. == Ча адары == Наадымның оюннарның үшкүзү - ча адары. Ча адар оюн ийи аңгы хевирлиг: баг адары болгаш кара адары. Ниитизи-биле алыр болза, шаандан тура ча биле согун көшкүн чонннарның шерииниң херекселдери кылдыр санаттынып турган. Ынчангаштың адар оюн шериг уран-чүүлүнге хамааржып турган. Оон чоорту, кажан оът-чепсек тыптып келгенде, ча адары шериг уран чүүлүнден аңгыланып, спорт хевиринче дамчааш, Наадымның база бир кол кезээ апарган. Баг адып турган үеде хараачыгай биле адыгжының аразы 100-150 базым кылдыр тургузар. Аразындан согун эртпес кылдыр, багларның аразын чоок-чоок кылдыр салыр. Дөрт багны мурнуку чарыынга тургузуп каар, ортузунга албан ""чүрек"" дээр эң кол баг салыр. Адыышкынның ийи дугаар хевириниң адар чүүлдери баг эвес, кара (мишень) бооп турар. Адыгжы биле адар черниң аразы оон-даа узун - 200-ден 300 чедир базым. Кара кылдыр өшкүнүң кежин маңнап чоруур аң хевирлиг кылдыр азып каар. Кештиң хөрек талазынче эң хөй катап аткан кижи тиилекчи болур.",tyv,Спорт (Sous-catégorie),,https://tyv.wikipedia.org/?curid=326,454,326.0,['ru'],False,Спорт,Sous-catégorie
,"Куулар, Даш-оол Сүрүң-оол оглу","Куулар, Сүрүң-оол оглу Даш-оол Ол 1943 чылда Өвүрнүң Торгалыгга төрүттүнген, чолаачы мергежилдиг чораан. 1969 чылда республика Наадымга 3-кү черни база 1971 чылда Тыва АССР-ниң тулган чемпиону дээш хүрешке 3кү черни, Тыва АССР-ниң спартакиадазынга 2-ги черни ээлээн. 1972 чылда ССРЭ-ниң 50 чыл оюнга тураскааткан Мөңгүн-Тайга районунуң Наадымынга 64 мөгениң хүрежинге 1-ги черни ээлээш, ""Мөңгүн-Тайганың чемпиону"" деп ат алган. 1972 чылда ССРЭ-ниң тургусутганының 50 чыл оюнга тураскааткан хүрешке 3кү черни ээлээн. 1973 чылда Сибирь болгаш Ыраккы Чөөн чүк улустарының спартакиадазынга 72 кг деңзиге 1-ги черни ээлээш, Россияның спорт мастери деп атты чаалап алган. 1981 чылда республика спартакиадазынга 72 кг деңзиге диилээн. == Дөзү == ""Тываның алдарлыг мөгелери"" (Знаменитые борцы Тывы). Ооржак Сергей Ынаажык оглу. 2005 ч.",tyv,Спорт (Sous-catégorie),,https://tyv.wikipedia.org/?curid=265,114,265.0,['ru'],False,Спорт,Sous-catégorie
,Анна Ивановна Беломытцев,"Анна Ивановна Беломытцева(1996 чылдыӊ ноябрь 24, Троицкое, Алтай крайы) - российжи футболист, камгалакчы. Россиянныӊ чыынды командазнныӊ кежигүүнү. == Допчу-намдары. == 12 харлыында тура спорт биле эдеришкен. С. Троицкоенниӊ ДЮСШ ѳѳреникчизи. Тренери Андрей Андрейцев. Чаш чораан чылдарында баскетбол, волейбол биле эдержип чораан. Сѳѳлзүредир Барнаулдун ДЮСШ-че шилчээн. Тренери Оксана Жбанникова. Улуг успортчулар аразынга 2011 чылда ийи дугаар лигага «Алтай» командазынга эгелээн. Анаа ийи сезон ойнаан. «2013 чылда Дээди дивизионнуӊ клуву «Рязанб ВДВ» - же кирген. Күскү сезонда чангыс оюнну эртерге, командазы чемпион атты чаалап алган. 2016 чылда Россия чемпионадынныӊ мѳнгун медалин чаалап алган. Ола чылда Россия кубогунга база ийиги черге тѳлептиг болган. 2018 чылдын сезонуннуӊ тунели биле Россия чемпиону болган. Рязань клуву дээш 47 оюнга ойнаан. 2019 чылдыӊ эгезинде Москванныӊ «Локомотив» дээш ойнап эгелээн. Ола чылын шупту оюннарга киришкеш, Россия чемпионадынга ийиги черге тѳлептиг болганнар. == Шилиндек командага тоогузу. == 15 харлыындан тура Россияныӊ чыынды командаларынга ойнап чораан. 2010 чылда 14 харлыг тургаш-ла бир дугаар оюнунга Турциядан келген команда-биле ужуражылгага оюнунга киришкен. Националдыг чыынды командага 2016 чылда октябрь 20де. Белгия биле оюнга киришкен. А бир дугаар голду 2018 чылда февраль 28-те Мурнуу Кореян хаалгазынче киирген. 2017 чылда Европа чемпионадынга түннел оюннун киржикчизи. == Шѳлүлгелер. == Профиль на сайте Soccerway (англ.) Профиль на сайте РФС Женское лицо российского футбола. Футледи этой недели - Анна Беломытцева",tyv,Спорт (Sous-catégorie),,https://tyv.wikipedia.org/?curid=8946,212,8946.0,['ru'],False,Спорт,Sous-catégorie
,"Царукаева, Светлана Касполатовна","Царукаева, Светлана Касполатовна (осет. Цæрукъаты Светлана) - российжи аар атлетика спортчузу. 2011 чылда Делегей чемпиону, Россиянның хүндүлүг спорт мастери. == Спортчу карьеразы. == Светлана Царукаева 2011 чылда Парижке. Делегей чемпиону. Чемпионаан кили 63. Маргылдаага уруг делегей рекордун тургускан: дораан кѳдүреринге - 117 кг, а идип үндүреринге 138 кг, ниити түңү - 255 кг. 2012 чылдың март 20-де Царукаева биле Хаджимурат Аккаев «Лучший тяжелоатлет 2011 года»- деп шаңналды «World Weightlifting» журналдың үндүргени биле алганнар. Тѳѳгүде бир дугаар Россиянның спортчулары шылгараңгай - деп шаңналды алганнар. Уругнуң шыгжамыырында 3 Делегейниң мѳңгүн медальдары бар. (2006 - 2009 чылдар) Светлана Царукаева Пекинге 2008 чылда болган олимпий оюннарынның киржикчизи. 2016 чылдың май 30-де спорт биле байырлашкан. 2017 чылдың апрель 5-те Делегейниң олимпий комитеди Царукаеваны 2012 чылда болган оюннарның мѳңгүн медалин хавырып алгаш барган. Чылдагааны - допинг - хыналданның түңнели. == Шаңналдары. == Медаль ордена «За заслуги перед Отечеством» I чаданның (13 август, 2012 чыл) - XXX Олимпий оюннарынга чедиишкини дээш. Болган чери: 2012 чыл, Лондоне (Великобритания). == Шѳлүлгелер. == Светлана Царукаева на сайте IWF",tyv,Спорт (Sous-catégorie),,https://tyv.wikipedia.org/?curid=8869,168,8869.0,['ru'],False,Спорт,Sous-catégorie
,"Воронцова, Людмила Сергеевна","Людми́ла Серге́евна Воронцо́ва (1999 чылдың февраль 22) - российжи боксёр. 2019 чылда Делегей чемпионадынның финализи. 2019 чылда Россия чемпиону, Россиянның чынды командазынның кежигүүнү. == Допчу намдары. == 1999 чылдың февраль 22-де Бурят Республиканның, Петропавловкага тѳрүттүнген. Башатй чиик атлетика болгаш спортчу ориентирование биле эдержип турган. 13 харлыында бодун камгалап ѳѳрениири-биле бокс секциязынга келген. Бир дугаар тренери Жаргал Тасарунов. СФО бирги чери дээш маргылдаага тиилелгени алгаш, дараазында Россиянның бирги чери дээш маргылдаага белени биле тиилеп алган. Хар четпези биле баштай шилиндек командаже кирбейн барган. 2016 чыылда Россиянның бирги чери дээш элээди уруглар аразынга тиилээш, спорт мастери атты чаалап алган. 2017 год чылда Россияга үшкү, а Европага - бирги черни алган. 2018 чылда Россиянның бирги чери дээш, Улан-Удэ алган. Ола чылда Делегей чергелиг спорт мастери атты чедип алган, а сентябрьда делегей чергелиг Польшага болган турнирге бир дугаар черни алган болгаш эң эки техника - дээш шаңналга тѳлептиг болган. В апреле 2019 чылдың апрельде, Кемеровога болган Россия чемпионадынга тиилээш, Делегей чемпионадынга киришкен. 2019 чылдң октябрь 3-те Улан-Удеге уруг ийиги черни алган. Финалга удурланыкчызы филиппин Нести Петесиога судьяларның аңгылашкан шиитпири-биле аштырыпкан. Амгы тренери Бадма Бадмаев, уруг спортчу клуб «Номто» кежигүүн.",tyv,Спорт (Sous-catégorie),,https://tyv.wikipedia.org/?curid=8854,189,8854.0,['ru'],False,Спорт,Sous-catégorie
