pageid,title,text,language,category,type,url,token_count,page_id,detected_languages,is_multilingual,main_category,source_type
,"Бавуу-Сюрюн, Мира Виктор кызы","Мира Викторовна Бавуу-Сюрюн азы Мира Викторовна Бавуу-Сүрүң (1956) - филолог, тыва дыл шинчилекчизи, профессор, Россияның тюркологтар комитединиң кежигүнү, РФ-ниң Өөредилге болгаш эртем яамызының федералдыг реестр экспертизи, Тываның күрүне университединиң Тыва филология болгаш ниити дыл эртеми кафедразының профессору, «Тюркология» деп эртем-өөредилгелиг төптүң үндезилекчилериниң бирээзи, баштайгы директору турган, дыл эртеминиң доктору, Тыва Республиканың эртем талазы-биле алдарлыг ажылдакчызы, Моолдуң өөредилге талазы-биле алдарлыг ажылдакчызы. == Намдары == М. В. Бавуу-Сюрюн 1956 чылдың август 20-де Улуг-Хем кожуунунуң Шагаан-Арыг хоорайга төрүттүнген. Ийи-Тал школазының 8 клазын дооскан, 1973 чылда Кызылдың No2 ортумак школазынче өөренип кирген. Кызылда күрүнениң педагогика институдунуң филология факультедин дооскаш, Тыва филология кафедразының ассистентизи кылдыр ажылдап турган. 1982 чылда ССРЭ-ниң Россияның эртемнер академиязының Сибирьде салбырының Төөгү, дыл база философия институдунуң аспирантуразынче кирип алган. 1988 чылда профессор, дыл эртемнериниң доктору М.И. Черемисинаның удуртулгазы-биле ""Тыва дылдың тодарадылга конструкциялары"" деп кандидат диссертациязын камгалап алган. Аспирантураны дооскаш, ККПИ-ниң филология кафедразының улуг башкызы, доцентизи кылдыр ажылдап, кафедраны удуртуп чораан. 1988 чылдан 1992 чылга чедир ККПИ-ниң өөредилге талазы-биле проректору чораан. 2006 чылдан - ТывКУ-нуң Тыва болгаш ниити языкознание кафедразының профессору. 12 чыл дургузунда (1997 чылдан 2009 чылга чедир) ТывКУ-нуң Тыва болгаш ниити дыл эртеминиң кафедразын удуртуп турган, ТывКУ-нуң «Тюркология» деп эртем-өөредилгелиг төптүң директору чораан, амгы үеде Тыва үндезин культура төвүнде эртем ажылдакчызы кылдыр ажылдап чоруур. == Ажыл-ижи == Мира Викторовна - хөй сонуургалдыг эртемден база салым-чаяанныг кижи. Хөй чылдарда тыва дылдың сөс чогаадылгазын шинчилеп чораан, дыка хөй эртем чүүлдериниң автору база электроннуг кожамыктар сөстүүнүң автору. 1994 чылда Мира Викторовна Турк дылдар ниитилелиниң чалааны-биле Анкарага (Турция) тыва дыл курстары эрттирип турган. Ооң киирген саналы-биле 2009 чылда ТывКУ-га бир дугаар гуманитарлыг эртемнерге хамааржыр Эртем-өөредиглиг төп ""Тюркология"" ажыттынган. Бөгүн ЭӨТ тыва дыл болгаш тыва чогаалды эртем талазы-биле шинчилээр чаа шагның төвү апарган. Мира Викторовнаның удуртулгазы-биле ""Тыва дылдың электроннуг чыындызын"" тургузар талазы-биле улуг белеткел ажылы чоргустунуп турар, ""Тываның чогаалчыларының сайтызы"" тургустунган ( Ооң удуртукчу салым-чаяанының ачызында ТывКУ-нуң Тыва дыл болгаш ниити дыл эртемнериниң кафедразы чылдың-на тыва дылга болгаш литератураның чидиг айтырыгларынга хамаарышкан эртем конференцияларын, семинарларны , өөредиринге хамаарышкан эртем методиктиг ажылдарны чорудуп турар. «Тыва дыл болгаш ниити дыл эртемнериниң кафедразының эртем бижимелдери"", «Сургуулдарның тыва дылга болгаш литературага хамаарышкан эртем ажылдары"" М.В. Бавуу-Сюрюн редакторлап үндүрүп турар. Ооң идепкейи-биле кафедра чанында тыва дылдың диалектилеринге хамаарышкан электоннуг өөредилге номнары үндүрүп кылып турар эртем-методиктиг лаборатория база ажыттынган. Кафедраны ол удуртуп турар үеде Моолдуң, Японияның, Американың, Чехияның, Турцияның, Германияның эртемденнери-биле быжыг харылзаа тургустунган. М. В. Бавуу-Сюрюн - дээди өөредилге черлеринге бир дугаар тыва дылдың лексикологиязынга хамаарышкан мергежилгелер чыындызының автору; Тыва дылдың синтаксизинге база сөс чогаадылгазынга хамаарышкан дыка хөй эртем ажылдарының автору; 60 ажыг эртем база эртем-методиктиг ажылдарның автору; 2018 чылда үнген школага 5-9 класстарга өөредилге номнарының соавтору. Моолда болгаш Кыдатта чурттап чоруур тываларның диалектилерин шинчилеп, ынаар эртем экспедицияларын кылган. Оон аңгыда Моолда чурттап чоруур тывалар боттарының дылын чидирбезин дээш, дыка улуг ажылды кылып чоруткан. Ценгел тываларынга тыва дылды өөренири-биле эге класстарга өөредилге программазын база өөредилге номнарын кылып тургузарын удуртуп турган. == Шаңнал-макталдары == Тыва Республиканың Өөредилге болгаш эртем яамызының хүндүлүг бижии (2006, 2007) Россия Федерациязының Дээди профессионал өөредилгениң хүндүлүг ажылдакчызы (2009) Хомду аймактың хүндүлүг хамаатызы (2009) «ТывКУ-нуң эртем талазы-биле алдарлыг ажылдакчызы» (2010) Академик Г. Н. Волков аттыг медалы (Элиста, Калмыкия; 2013) Моолдуң хүндүлүг башкызы (2014) Цагаан-Нур суурнуң хүндүлүг бижии(2014) Моолдуң өөредилге талазы-биле алдарлыг ажылдакчызы (2015) Тыва Республиканың эртеминиң алдарлыг ажылдакчызы (2020).",tyv,Random,,https://tyv.wikipedia.org/?curid=7837,534,7837.0,['ru'],False,Random,Aléatoire
,Хүн (сылдыс),"Хүн (демдээ: ) - Хүн системазының төвү. Ол Хүн системазының телоларының аразында херелденип, чырып турар кара чаңгыс тело. Хүннүң чырыы, чылыы Чер кырынга болгаш бүгү планеталарга амыдырал-чуртталганың чаңгыс үнер дөзү. Хар, чаъс, хат, хемнерниң агыышкыны база бүгү-ле болуушкуннар Хүннүң энергиязының ачызында болуп турар. Хүн биске эң чоок турар сылдыс. Ол өске сылдыстардан хемчээл, масса, температура болгаш чырык-даа талазы-биле улуг ылгал чок. Хүн биле сылдыстарның тургузуунуң ниити байдалы барык-ла ылгашпас. Хүннүң көстүп турар ортумак диаметри булуңнуң 1919 секундазынга дең. Ооң диаметри 1,34 сая километр. Черниинден 109,1 катап улуг. Объему Черниинден 1,3 сая катап улуг, азы 1,4·1018 м3. Массазы Чернин массазындан 33000 катап артык, азы 2·1027 т. Ооң бүдүмелиниң дыгыйы Черниинден 4 катап эвээш, куб сантиметрде 1,4 грамм. Ында тыртыжыышкын кужу Черден 27,9 катап улуг. Чырыы 3·1027 лаа чырыынга дең. Ооң херелдениишкин энергиязы 3,7·1023 квт, азы 5·1023 аът кужунге дең. Ол энергияның ийи миллиардтың чүгле бир кезии Чер кырынга келир. Хүннүң бир секундада үндүрер энергиязы 11,5·1012 т хөмур-дашты кывысканынга дең. Ооң кырының температуразы 6000°. Бедик температурага газтарның атомнары ионнарже шилчий бээр болганда, Хүннүң бүдүмели плазмадан тургустунган. Ооң массазының 99% водород болгаш гелийден бүткен. Оон аңгыда, ында 70 хире химиктиг элементилерниң бары илерээн. Фотосфера - Хүннүң көстүп турар херелдери тургустунар атмосфераның кол кезии. Фотосфера Хүннүң «дашты» бооп көстүр. Бүгү-ле херелдер оон кээр. Ооң ортумак температуразы 6000°. Фотосфераның чалгыглары өөрү тарап үнгүлээш, чалгыглар энергиязын тургузуп, ол энергияны чылыг энергиязынче шилчидер. Ооң ужурундан фотосфераның температураз каш-каш муң градус четкилээр. Фотосфера - Хүннүң эң «соок» облазы болур. Фотосфераның кырында, 12-15 муң километрде, көстүп турар чырыкты шаптык чокка эртирер каътты хромосфера деп адаар. Хромосфераның чаңгыс аай бедиинде температура ылгалдыг туруп болур. Ооң соок черлеринге колдуунда водород, изиг черлеринге гелий чырып тургулаар. Ооң кырынын тургузуу нарын. Хромосфераның «изиг» черлериниң температуразы 30 муң, «соок» черлериниң 10 муң градус чедип турар. Хүннүң атмосферазының кырында кезиин корона деп адаар. Ооң температуразы секундада 150 километр шимчээр ионнар энергиязынга дүгжүр. Ол “ийиги космос” дургенинден элээн каш катап эвээш шимчээшкин-дир. Ионнарның дүргени оон улгадыр болза, олар Хүннү каапкаш, чоруптарлар. Ынчангаш коронаның кинетиктиг энергиязы 1-2 сая градустан ашпас. Хүнде магниттиг шөл бары илерээн. Ооң полюстарының чоогунда шөлдүң күжениишкини 1 эрстед. Ол болза Черниинден 2-3 катап улуг. Хүннүң магниттиг шөлү нарын. Аңгы-аңгы полюстарлыг кезекчигештер ол шөлдү тургузуп турар. Ынчангаш магниттиг шөлдүң полюзу база үргүлчү өскерлип турар. Хүннүң магниттиг шөлдери ында бүдүмелдерниң холужуп шимчээринге шаптык болбайн, изиг газтарның өрү бедип көдүрлүрүнге чүгле угланыышкынны тургузар. Ол областарга фотосфераның температуразы 200-300° четкилээр.",tyv,Random,,https://tyv.wikipedia.org/?curid=430,393,430.0,['ru'],False,Random,Aléatoire
,"Панарина, Вера Зиновьевна","Панарина Вера Зиновьевна (20 май 1930 - 24 июль 2002) - совет көдээ ажыл-агыйның мурнакчызы, «Стемасский» совхозтуң саанчызы Алатырский район Чуваш АССР, Социалистиг Күш-ажылдың Маадыры (1966). == Намдары == 1930 чылда көдээ суур Борки Алатырского район Чуваш АССР тараачын өг-бүлеге төрүттүнген. Школага өөредилгезин дооскаш тус черниң колхоз хову ажылы бригадазынче ажылдап кирген, а ооң соонда хаван фермазынче. 1951 чылда совхоз ""Стемасский"" малчын фермазынче ажылдап шилчээн. Эгезинде дузалал саанчылап ажылдап турган - заменяла основных саанчыларны когда те находились на выходном или в отпуске. Через полтора года ей разрешили набрать группу нетелей, которых она готовила к пополнению в основное стадо. Постепенно набиралась опыта, надои в её группе стали расти. От 25 закреплённых коров она стала получать по 3000 килограммов молока в среднем за год. Стадо отличалось ухоженностью, чистотой и упитанностью. Немалую помощь ей оказывал её супруг, который работал фельдшером. 1965 чылда ол вступив в социалистическое соревнование сумела достичь показателя в 3406 килограммов от каждой коровы в среднем за год. «За достигнутые успехи в развитии животноводства, увеличении производства и заготовок мяса, молока, яиц и шерсти и другой продукции», ССРЭ-ниң Дээди Совединиң Президиум 22 март 1966 чылдың Чарлыы-биле Вера Зиновьевна Панаринага Социалистиг Күш-ажылдың Маадыры атты тывыскан Ленин ордени тыпсыры база «Серп биле Молот» медальдар. Көдээ ажыл-агыйга Продолжала и дальше трудиться. 1986 чылда пенсияже үнеринге чедир работала заведующей фермой крупного рогатого скота. Көдээ суур Восход Алатырский районга чурттап турган. 24 июль 2002 чылда чок болган. Көдээ суурнуң чевээнге орнукшуткан. == Шаңналдары == Күш-ажылчы чедиишкиннер дээш шаңнаткан турган: алдын сылдыс «Серп биле Молот» (22.03.1966) Ленин ордени (22.03.1966) өске медальдар. == Чогаал == Наши земляки - Герои Социалистического Труда. - Чебоксары, 1971. Краснова. И. Когда труд - радость / И. Краснова // Совет. Чувашия. - 1966. - 27 марта. Мадебейкин, И. Н. Панарина Вера Зиновьевна / И. Н. Мадебейкин // Краткая чувашская энциклопедия. - Чебоксары, 2001. - С. 313. Мадебейкин, И. Н. Панарина Вера Зиновьевна / И. Н. Мадебейкин // Чувашская энциклопедия. - Чебоксары, 2009. - Т. 3 : М-Се. - С. 367. == Шөлүглер == Панарина, Вера Зиновьевна (ru). Сайт «Герои страны».",tyv,Random,,https://tyv.wikipedia.org/?curid=9095,339,9095.0,['ru'],False,Random,Aléatoire
,Эмчи,"Эмчи - эрте-буруңгунуң мергежили. Оларның эртемин Медицина (Эмнээшкин) дээр. Медицинаның төөгүзү - эмчилерниң төөгүзү болур. == Эртеминиң төөгүзү == Медицинаның төөгүзү буруңгу Египет, Рим, Индия, Кыдат, Япониядан укталган. Римге ол эртем дүрген сайзыраан. Медицинаның адазы Гиппократ медицина эртемин ""философчу ёзу-биле Бурганга"" деңнеп көрген. Анатомияның эң баштайгы өөредилге ному 1326 чылда чырыкче көстүп келген, ону Болонск университединиң магистр башкызы Мондильо де Луцца бижээн. Ону кайгамчыктыг чедиишкин деп санап турар. == Эмчиниң салымы == Эмчилерниң мергежили белен эвес, кандыг-даа байдалга тургаш, акша-шалыңы чеже-даа куду болза, олар ажылын соксадырын бодавас, дүжүнге безин кирбейн чоруур. ынчы, ачы-буянныг, сагыш човаачал, кичээңгейлиг, кээргек болурунуң дугайында Гиппократтынң даңгыраа ийи чүс ажыг чылдар иштинде өскерилбээн. XX чүс чылдың төнчүзүнде бүгү делегейниң эмчилер конгрезинге чаңгыс домак немешкен: ""Бүгү чуртталгам иштинде өөрениримни даңгыраглап тур мен"" . == Дөзүк == ""Ава"", Тываның херээженнер солуну. No8, 2014 чылдың июнь.",tyv,Random,,https://tyv.wikipedia.org/?curid=1752,141,1752.0,['ru'],False,Random,Aléatoire
,"Тимербулатов, Виль Мамилович","Майык:Однофамильцы Майык:Учёный Виль Мамилович Тимербулатов (1 июнь 1952 төр., Ишеево, Стерлитамакский район, бо үеде Ишимбай район РБ) - хирург, профессор, медицина эртеминиң доктору (1989), РАМН кежигүн-корреспондентизи, академик Академии наук Башкортостана, академик Петровской академии наук (1995), Президент ассоциации хирургов Республики Башкортостан. РФ алдарлыг эмчизи (2005), заслуженный врач РБ (1990), заслуженный деятель науки РФ (1998). Депутат Государственного Собрания РБ (3 и 4 созывов), ректор Башкирского Государственного медицинского института (1994-2011). == Намдары == Тимербулатов В. М.1 июнь 1952 чылда көдээ суур Ишеево Стерлитамакского района БАССР төрүттүнген, бо үеде Ишимбайского района РБ. Макаровскунуң ортумак школазынга өөренип турган. 1975 чылда Башкир медицина институтту дооскан. Эмчи-хирург. 1983 чылдан - медицина эртеминиң кандидады, 1989 - медицина эртеминиң доктору, профессор (1991), РФ алдарлыг эртем ажылдакчызы (1999), РФ алдарлыг эмчизи (2005), РФ кадык камгалал тергиини (2004), РЭМА кежигүн-корреспондентизи (2005), АН РБ академиги (2009). Благовещенской ЦРБ БАССР хирург (1976-1979), клиника ординатор, хирург ГКБ No 8 г. Уфы (1979-1982), 1982 чылдан БГМИ-де (бо үеде БГМУ): 1988 чылдан кафедра эргелекчизи, хары угда 1994 чылдан 2012 чылдарга чедир ректор; 1990-1994 чылдарда кол хирург Министерства здравоохранения РБ. Эртем угланыышкыны: колопроктология, абдоминальная, миниинвазивная, ириңниг хирургия. Разработал новые методы диагностики, комплексной терапии и реабилитации больных острым парапроктитом; диагностическую и лечебно-тактическую программы по острой кишечной непроходимости; сформулировал концепцию патогенеза дивертикулеза ободочной кишки. Внёс вклад в решение проблем абдоминальной хирургии, в развитие радиочастотной хирургии. Под его руководством создана программа по развитию эндоскопической хирургии в РБ. Создал научную школу в области колопроктологии. == Өөреникчилери == Ооң өөреникчилериниң аразында 16 докторлар база 44 эртем кандидаттары. == Парлаан чүүлдери == Тимербулатов - 811 эртем ажылдарының автору, оон иштинде 40 монографиялар, 65 чогааттынган чүүлдерниң, 2 хирургтарга тайылбыр номнары Регионарная анестезия и новокаиновые блокады в хирургии. Уфа, 1993 (кады чогаадышкан автор). Дивертикулярная болезнь толстой кишки. М., 2000 (кады чогаадышкан автор). Желчнокаменная болезнь и холецистит. М., 2001 (кады чогаадышкан автор). Профилактика гнойно-септических осложнений в хирургии. М.: Триада, 2003 (кады чогаадышкан автор). Хирургия абдоминальных повреждений. М.: МЕДпрессинформ, 2005 (кады чогаадышкан автор). Лучевая диагностика тромботических осложнений в хирургической клинике. Уфа: «Здравоохранение Башкортостана», 2009.(кады чогаадышкан автор) == Шаңналдары == Лауреат премии РАМН имени А. Н. Бакулева (2004). Награждён орденом Салавата Юлаева (2007) и орденом Дружбы (2013). Золотая медаль Академии А. М. Вишневского. Уруглары: Тимербулатов Махмуд Вилевич Тимербулатов Шамиль Вилевич Тимербулатов Роберт Вилевич == Демдеглелдер == Майык:Start box Майык:Succession box Майык:End box",tyv,Random,,https://tyv.wikipedia.org/?curid=11474,374,11474.0,['ru'],False,Random,Aléatoire
