pageid,title,text,language,category,type,url,token_count,page_id,detected_languages,is_multilingual,main_category,source_type
8680.0,"Базыр, Лидия Каң-ооловна","Базыр Лидия Каң-ооловна (1959 чылдың октябрь 11, Бай-Хаак суур, Таңды кожуун, Тыва Автономнуг область) - Тываның музей ажылының хоочуну, ""Сокровища Долины царей Тувы. Царский курган Аржаан-2"" деп делгелгениң тургузукчуларының бирээзи. == Намдары == Лидия Каң-ооловна Базыр 1959 чылдың октябрь 11-де Тыва Автономнуг Облазының Таңды кожуунунуң Бай-Хаак суурга малчын өг-бүлеге төрүттүнген. Тываның күрүне университедин чедиишкинниг дооскан. 1988 чылдың мартта Тываның чурт-шинчилел музейинге ажылдап чедип келген турган. Баштай ол эртем-өөредиглиг килдиске экскурсоводтап ажылдап кирип алган. Ооң соонда эртем-өөредиглиг килдистиң бойдус килдизиниң эргелекчизи кылдыр база музейжи башкы кылдыр ажылдаан. Музейге ажылдап келген үезинде музей ажылының бүрүнү-биле шиңгээдип алган болгаш, чоорту музейниң кол экскурсоводу апарган. Тываның чогаалчыларының уран чүүлдүг салгалын, Тываның культуразын, төөгүзүн шинчилеп чораан. Музейге-даа, музей даштынга-даа дыка хөй хемчеглерни: Тываның чогаалчыларының номнарының бараадылгаларын, Тываның алдарлыг кижилеринге тураскааткан уран чүүл кежээлерин эрттирип келген. Лидия Каң-ооловна С. К. Токага, Е. Б. Байынды, А. Д. Грачыга тураскааткан делгелгелерниң автору. ""Сокровища Долины царей Тувы. Царский курган Аржаан-2"" деп делгелгениң тургузукчузу. 2017 чылда хүндүлүг дыштанылгаже үнген. == Бижээн чүүлдери == Базыр, Л. К. Кызыгаар чок ужар куштар : [дириг амытаннар дугайында] // Сылдысчыгаш. - 2009. Базыр, Л. К. Төөгүлүг найысылалывыс : [Кызыл хоорайның 75 чылынга] // Шын. - 2009. Базыр, Л. К. Культурное развитие Тувинской Народной Республики в экспозиции Национального музей им. Алдан-Маадыр Республики Тыва. К 90-летию Тувинской Народной Республики 1921-1944. // Мартьяновские краеведческие чтения. Минусинск, 2012. Вып. VII. С. 34-38. Базыр, Л.К. Сыновья Чагытая : [о воинах-добровольцах Великой Отечественной войны Тандинского района] // Великая Отечественная война в исследованиях ученых, воспоминаниях и письмах фронтовикв : материалы Круглого стола, посвящ. 65-летию Победы. Кызыл, 2010. С. 215-219. == Шаңналдары == Тыва Республиканың Дээди Хуралының хүндүлүг бижии (2013) Тыва Республиканың Чазааның Даргазының Хүндүлүг бижии (2013) Тыва Ресубликаның Культура яамызының хүндүлүг бижиктери. == Литература: == Базыр Лидия Кан-ооловна // Азия Төвүнүң херээженнери = Женщины Центра Азии. Кызыл, 2014. - Т.2. А. 73. Базыр Лидия Кан-ооловна [к 50-летию со дня рожд.] // Летопись Тувы - 2009. Кызыл, 2008. С. 160-161. Базыр Лидия Кан-ооловна // Библиографический указатель. Национальный музей им. Алдан-Маадыр Республики Тыва - 90 лет: история и современность. Кызыл, 2019. == Шөлүглер == Вышла в свет книга Лидии Иргит «Славные дочери Тувы» Национальный музей Тувы отмечает 90-летие со дня основания",tyv,Культура,ordonné,https://tyv.wikipedia.org/?curid=8680,358,,['ru'],False,Культура,Catégorie principale
8684.0,"Доңгак, Валерия Чаш-ооловна","Доңгак Валерия Чаш-ооловна (1964 чылдың март 22, Саглы, Өвүр, Тыва АССР) - Тываның музей ажылының хоочуну. == Намдары == Валерия Чаш-ооловна Доңгак 1964 чылдың март 22-де Тыва АССР-ниң Өвүр кожуунунуң Саглы сумузунга төрүттүнген. Тываның чурт-шинчилел музейинге 1994 чылда кадагалакчылап ажылдап эгелээн. Ооң соонда бойдус килдизиниң биче эртем ажылдакчызы кылдыр ажылдап тургаш, фонду килдизиниң улуг кадагалакчызы кылдыр ажылдап турган. Музейге 20 ажыг чыл дургузунда музейниң фондузунда бойдус-эртемниг чыыштың чүүлдерин кадаглаарынга улуг үлүг хуузун киирген. В. Ч. Доңгак бодунуң фондузунуң чүүлдериниң санын көвүдедир талазы-биле, оларны шинчилээр талазы-биле база делгередир талазы-биле улуг ажылды кылып турган. Музейниң дыка хөй делгелгелерин кылып тургускан: ""Кызыгаар чок куштар"", ""Аргаже кыйгыртканнар"", ""Күштүг боор кылдыр төрүттүнгеннер"", билдингир таксидермист И. М. Путинцевтиң 85 харлаанга тураскааткан ""Ийиги чуртталганы сөңнээр"" деп делгелгези база үргүлчү музейде турар делгелгелерниң соавтору: ""Тыва - Азия төвүнүң эртинези"", ""Тайга: бойдус-биле тудуш"". Эртем-практиктиг конференцияларга, семинарларга, төгерик столдарга база үргүлчү киржип турар. Амгы үеде Валерия Чаш-ооловна Тыва Республиканың национал музейиниң бойдус болгаш чурт-шинчилел килдизиниң улуг эртем ажылдакчызы база проэвилелдиң даргазы. == Бижээн чүүлдери == Донгак, В. Ч. Естественнонаучные коллекции Национального музея Республики Тыва : состав и современное состояние // I Ермолаевские чтения, посвященные 120-летию со дня рождения первого директора Национального музея Республики Тыва В. П. Ермолаева. Кызыл, 2012. А. 122-126. Донгак, В. Ч. Лекарственные растения в естественнонаучном фонде Национального музея Республики Тыва // Музей и вопросы сохранения, изучения и использования культурного наследия : материалы научно-практической конференции, посвященной 85-летию со дня рождения Н.М. Богатырева и 100-летию единения России и Тувы. Кызыл, 2014. А. 202-206. Донгак, В. Ч. Обзор этномологической коллекции в Национальном музее Республики Тыва // Материалы конференций ГНИИ ""Нацразвитие"". Санкт-Петербург, 2016. А. 87-88. Донгак, В. Ч., Кыргыс, Ч.С. Обзор коллекций: мелкие млекопитающие таксидермических работ в фондах Национального музея Республики Тыва / The collection review: Taxidermy works on small mammals based on the fund materials of the National Museum of the republic of Tuva // Вестник Восточно-Сибирского государственного института культуры. 2019. А. 67-78. == Литература == Валерия Чаш-ооловна Донгак : [о ветеране музея] // Национальный музей имени Алдан-Маадыр Республики Тыва (1929-2014) : юбилейный альбом, посвященный 85-летию основания музея. Новосибирск: Сиб. огни, 2014. А. 26. Донгак Валерия Чаш-ооловна [о сотруднике музея] // Библиографический указатель. Национальный музей имени Алдан-Маадыр Республики Тыва - 90 лет: история и современность. Кызыл, 2019. А. 161-164. == Шөлүглер == 1. Обзор коллекций: мелкие млекопитающие таксидермических работ в фондах Национального музея Республики Тыва (чедимчок шөлүг) 2. Выставка в лагере «Юность»",tyv,Культура,ordonné,https://tyv.wikipedia.org/?curid=8684,392,,['ru'],False,Культура,Catégorie principale
1667.0,"Доңгак, Вячеслав Октяброович","Вячеслав Октяброович Доңгак (август 22, 1955 төр.) - 2010-2014 чч. Тыва Республиканың Уран чүүл сайыды (Тыва Республиканың Культура сайыды), Тыва Республиканың уран чүүлүнүң Алдарлыг ажылдакчызы. 1992 чылдан тура Тываның Күрүне филармониязының «Саяннар» деп ансамблиниң удуртукчузу, 2007-2009 чылдарда Тыва Республиканың культура болгаш информациялыг политика сайыды, 2009-2010 чылдарда Тыва Республиканың культура болгаш туризминиң сайыды кылдыр ажылдаан. «Культурада чедиишкиннери дээш» хөрек демдээниң, «Шылгараңгай күш-ажыл дээш» медальдың эдилекчизи. Вячеслав Октяброович 1955 чылдың август 22-де Тыва АССР-ниң Улуг-Хем кожууннуң Хайыракан сумузунга төрүттүнген. 1977 чылда А.В.Луначарский аттыг театр уран чүүлүнүң Күрүне институдун «Режиссура балета» деп мергежил-биле дооскан. 1974 чылдан тура «Саяннар» деп күрүнениң ыры-сам ансамблинге балет артизи бооп ажылдап эгелээн. 1982 чылдан эгелеп Тываның хөгжүм-шии театрының база «Саяннар» күрүнениң ыры-сам ансамблиниң балетмейстери, 1992 чылдан тура ансамбльдиң удуртукчузу. 2002 чылда Республиканың юридика лицейиниң эстетика башкызы болуп ажылдаан, 2003 чылда Кызыл хоорайның мэриязының культура салбырының начальниги, оон даргазы болуп ажылдаан. 2007-2009 чылдарда Тыва Республиканың культура болгаш информациялыг политика сайыды, 2009-2010 чылдарда Тыва Республиканың культура болгаш туризминиң сайыды кылдыр ажылдаан. 2010 чылдан тура Тыва Республиканың культура сайыды.",tyv,Культура,ordonné,https://tyv.wikipedia.org/?curid=1667,171,,['ru'],False,Культура,Catégorie principale
1462.0,Лиди,"Лиди (төвүт le’u tho ‘чыынды, бүрүткел’; өске ады хүн-дизик, календарь) дээрде магаботтар шимчээшкининиӊ өйлеп катаптаарынга үндезилетинген узун үе аразын санаарыныӊ ёзу-чуруму. Чижелээрге Хүннүӊ шимчээшкининиӊ өйлеп катаптаарынга үндезилеттинген лидини - хүн лидизи, Айныӊ - ай лидизи дээр. Оон аӊгыда байырлалдарны демдеглеп каан, чедиликтерге (неделяларга), айларга чарып үскен хүннер даӊзызын болгаш база лиди (хүндизик) дээр. == Лидиниӊ төөгүзү == Эӊ буруӊгу билдингир лиди Бурунгу Египетке болгаш Шүмерге турган. Делегейниӊ чон бүрүзү бодунуӊ төөгүлүг болуушкуннарныӊ үе-шаг айтылгазыныӊ аргаларын ажыглап турган. Оларныӊ бир кезээ өртемчейниӊ чаяаганындан үени санап турган: чижелээрге еврейлер ону бистиӊ эрага чедир (б.э.ч.) 3761 чылдан, христиан дорт-чүдүлгелиглер (орус. православные) - б.э.ч. 5493 чылдан эгелеп санап турган. Буруӊгу Румчулар Рум (Рим) хоорайныӊ б.э.ч. 753 ч. тургустунганындан, парфийлер, вифинчилер болгаш селевкидтер бидунуӊ бирги хааныныӊ дүжүлгеге олурупканандан, бурунгу мысыржылар - дараазындаагы хаанкаӊы (династия) бүрүзүнүӊ чагыргазындан эгелеп санап турган. Делегей чергелиг шажыннар база бодунуӊ лидизин тургускан. Ынчаарга пурум (византий) лиди-биле алыр болза бөгүн өртемчей чаяаганындан бээр 7523 чыл (амгы 2014 чыл) эртип чыдар, исламда - хыжыраныӊ 1436 чылы, Бурганчы (Буддажы) лиди-биле Паранирваанныӊ 2558 чылы эртип турар. Тыва Арат Республика (ТАР) үезинде чыл санаашкынын ТАР-ныӊ тургустунган чылындан санап эгелеп турган. Чижелээрге, ТАР-ныӊ 1-ги чылы - 1921 чыл, ТАР-ныӊ 2-ги чылы - 1922 чыл, ТАР-ныӊ 3-кү чылы - 1923 чыл. Хүн биле Айныӊ эвес, өске сылдыстарныӊ бир чүүлүнүӊ санаашкынынга үндезилетинген лидилер база бар. Чижелээрге, буруӊгу египет лидиде чыл дээрге Аскыр (Сириус) сылдыстыӊ даӊ хаяазында өйлеп-өйлеп үнер үелериниӊ аразы-дыр. Ынчангаш мындыг лидилер хөлчок ховар болур. Чылдыӊ аӊгы-аӊгы үргүлчүлели болгаш чаа чылдыӊ янзы-бүрү ай-хүнү дээш өске-өске лидилиг ёзу-чурумнарда бир чыл санаашкынындан өскезинче шилчиири берге болур. Чылдыӊ саналгазын бир айныӊ 1-ден Румга б.э.ч. 45 ч. Юлий Цезар киирген (юлиан лиди). == Түрк-моол лиди == Түрк-моол чоннар аразында үе шагдан бээр уламчыктыг (традициялыг) 60-чылдыӊ эргилдиг (циклдыг), ооӊ иштинде беш 12-чылдыг биче эргилдерлиг лидизин ажыглап чораан. Ону «Мөчүл» азы «Мөчел» (моол мөчлөг, казак мүшел, кыргыс мүчөл, хакас мӱчел) дээр, ынчангаш бир биче 12-чылдыг эргилдиӊ чыл бүрүзүн кандыг-бир амытан ады-биле адап турган. «Мөчүл» деп ат «мөчү» (мага-боттуӊ кезектери; даван-даяк) деп сөстен укталган болгаш буруӊгу түрктерде дагым (жертвенный) амытанныӊ коӊ эъдиниӊ 12 кезекке чарлыырыныӊ дугайында болгаш буруӊгу түрк эмнээшкининиӊ кижиниӊ мага-бодунуӊ 12 кезектиг туругузуунуӊ билии-биле дүгжүп турар. 60-чылдыг лиди бен 12-чылдыг эргилдерден өске ийи 10-чылдыг эргилдерге база чарлып турар. Оларныӊ бирээзи 5 эжеш өӊнерлиг - көк - көксүмээр, кызыл - кызылсымаар, сарыг - сарыгзымаар, ак - аксымаар, кара - карасымаар, өскези - эр-кыс кылдыр хувватынган 5 магабутардан (магабут - первоэлемент) тургустунган: ыяш, от, чер, демир, суг. === Тыва мөчүл айлары === Тыва мөчүде айларны дугаар азы чыл өйүнүӊ (сезон) аайы-биле адап турган. Тывалар мөчүлден өске чыл-өйнүӊ лидизин ажыглап турган. Ында айларны ол айларада колдап турар ажыл-агый аайы-биле адап турган. === Чедиликтиӊ хүннери === Тывалар чедиликтиӊ (неделяныӊ) хүннерин - хүн бүрүде ажыглап турар лидиде дугаар аайы-биле, чурагайда (астрология) болгаш албан-ёзу херектеринде бурганчы (буддажы) чурагайга ажыглап турар карыктарныӊ (планеталар) тыважыткан төвүт биле санскрит аттары-биле адап турган. == Ажыглаан номнар болгаш чүүлдер == Амыдыралдыӊ угаадыы. - Моол дылдан очул. Г.Б. Санчаа. - Кызыл, 1993. Володомонов Н.В. Календарь: прошлое, настоящее, будущее. - Изд. 2-е. - М.: «Наука», 1987. Древнетюркский словарь. - Л.: Изд. «Наука», Ленингр. отд., 1969. Климишин И.А. Календарь и хронология. - Изд. 3-е. - М.: «Наука», 1990. Скородумова Л. Дзурхай: Буддийская астрология. - Владивосток: «Pубеж», 1994. Сүхбаатар О. Монгол хэлний харь үгийн толь. - Улаанбаатар, 1997. Сайт о календарях",tyv,Культура,ordonné,https://tyv.wikipedia.org/?curid=1462,543,,['ru'],False,Культура,Catégorie principale
