pageid,title,text,language,category,type,url,token_count,page_id,detected_languages,is_multilingual,main_category,source_type
,"Селезнёва, Наталья Игоревна","Ната́лья И́горевна Селезнёва (1945 чылдың июнь 19 та, Москва, ССРЭ) - совет болгаш Россия Федерациязынның артизи. Россия Федерациязыныӊ чоннуң артизи. Польшаның хүндүлүг культура ажылдакчызы. (1976). == Намдары == Москва хоорайга 1945 чылдың июнь 19 төрүттүнген. Ачазы, Игорь Николаевич Полинковский, чурук тыттырар мастер чораан. Авазы, Елена Семёновна Селезнёва - чурукчу. 6 харлыында Совет Армия театырынга кол ролюн ойнаан. Кинога - 1953 чылда. (Бир дугаар ойнаан ролю - «Алёша Птицын характерин кижизидип турар» - деп кинода Сашенька). 1965 чылда бир дугаар чедиишкинге таварышкан. Ойнаан кинозу Леонид Гайдайның «Операция «Ы» болгаш Шуриктиӊ ѳске ужуралдары». 1966 чылда Борис Щукин аттыг театр училищезин дооскан. Курс Борис Захаванның. Ола чылда Шоодуглар театырынныӊ артизи апарган. Дараазында ийи катап Гайдайның комедияларынга тыттырган: «Иван Васильевич профессиязын солуп турар» болгаш «Ол ындыг болбас ужурлуг!» Ат-алдар чедип алырынга телевидениянныӊ «13 сандай» дамчыдылгазы улуг идигни берген, анаа артист пани Катаринанны ойнаан. Хууда чурталгазы: 1968 чылда «Калиф-аист» - деп кинога тыттыырып тургаш актёр Владимир Андреев биле таныжып алган. Ур болбаанда кудазын эттиргеннер. 1969 чылдың май 11 де оларныӊ оглу Егор Владимирович Андреев тѳрүттүнген. Ол - дипломат. Ам артист үш уйнуктуг: Алексей (1995), Елизавета (2010) и Николай (2011). == Төре көрүжү == «Чаңгыс демниг Россия» партияның кежигүнү. 2007 чылда партияның Күрүне Думазынның бешки кыйгызынче соӊгулдаларга идегелдиг улустар даӊзызынче кирген. Ынчангаш Күрдуманның спикери Борис Грызлов-биле ужуражылгаже чалаттырган. Грызловтуң илеткелинниң соонда сѳс алгаш мынча деп чугаалаан: «Мен силерниӊ көдээ ажыл-агый дугайында илеткелиӊерге чѳпшээрешпес мен! Мен удаа-дараа чуртка чоруп турган болгаш сандараашкнны көрген мен. (.....) Бажыӊ садып алыр дугайында база шын эвес чугааладыңар, чүге дээрге ону бо үеде чүгле Россияны оорлап турар улус садып алыр аргалыг. Ол чугаазынныӊ соонда артисти бүзүрелдиг улустуң даңзызындан ап каапканнар. == Тыттырган кинолары == 1.1953 - Алёша Птицын вырабатывает характер - Сашенька 2.1956 - Девочка и крокодил - Катя Пастушкова 3.1961 - Алёнка - Елизавета, Нюраның угбазы 4.1965 - Операция «Ы» и другие приключения Шурика (новелла «Наваждение») - Лида, Политехниктиг институдунуң студентизи 5.1966 - Саша-Сашенька - Саша Крылова, маляр 6.1966 - Кто придумал колесо? - Зойка 7.1967 - Я вас любил... - Лидия Николаевна, чогаал башкызы 8.1969 - Калиф-аист - Принцесса 9.1969 - Старый знакомый - Наташа Кольцова, чурукчу 10.1970 - Как мы искали Тишку - кижизидикчи 11.1970 - Приключения жёлтого чемоданчика - Петина авазы 12.1970 - Соло (короткометражный) - Соня 13.1972 - Точка, точка, запятая... - участок эмчизи 14.1973 - Иван Васильевич меняет профессию - Зинаида Михайловна Тимофеева (Зина), Шуриктиң кадайы 15.1974 - Свой парень - Аля Малышева 16.1975 - Не может быть! (новелла «Забавное приключение») - Танюша, Барыгин-Амурскийниң кадайы 17.1977 - Приключения Нуки - Алёшаның авазы 18.1977 - Эти невероятные музыканты, или Новые сновидения Шурика - камео 19.1978 - По улицам комод водили (новелла «Мы едем, едем, едем...») - Вика 20.1979 - Тема - Светлана, К. А. Есенин өөреникчизи 21.1981 - Ожидаются похолодание и снег (короткометражный) - эпизод 22.1982 - Берегите мужчин! - Алла, сослуживец и подруга Марфы Петровны 23.1986 - Я тебя ненавижу 24.1992 - Круг обречённых - Фима Кораблёва, редакцияның ажылдакчызы 25.1992 - Звёзды на море - Владимирниң авазы 26.1995 - Дом 27.1996 - Импотент - Татьяна, Михаилдиң кадайы 28.1996 - Клубничка - Сюзанна Ивановна Цыпа (22-я серия) / налоговый инспектор (40 дугаар серия) 29.1997 - Старые песни о главном 2 - пани Катарина 30.1998 - Старые песни о главном 3 - Зина Тимофеева 31.1998 - Примадонна Мэри - Инна, Бористиң кадайы 32.2000 - Агент в мини-юбке - Наталья Ивановна 33.2001 - С точки зрения ангела - Тереза Константиновна 34.2002 - Улыбка Мелометы - активчи 35.2002 - Сын неудачника - Аркадийниң авазы 36.2003 - Юбилей прокурора - прокурорнуң кожазы 37.2003 - Love-сервис - Маргарита Семёновна, душтук 38.2004 - Воры и проститутки. Приз - полёт в космос - Елена Дмитриевна Стасова, МОПР даргазы 39.2006 - Вы не оставите меня - Наталья Васильевна, Верочканың авазы (Алла Сурикова үннелдирген) 40.2007 - Крик в ночи 41.2007 - Аферисты - Симаның даай-авазы, Юляның кожазы 42.2008 - Воротилы - Клавдия Семёновна, Деменконуң бажыңында чалча херээжен 43.2009 - Мама-Москва (не был завершён) 44.2013 - Страна хороших деточек - кырган-авазы 45.2014 - Новогоднее дежурство - Агнесса Леопольдовна == Шаңналдары == Польшаның культураның алдарлыг ажылдакчызы (1976) РСФСР-ниң алдарлыг артизи (1981) РФ-тиң улусчу артизи (1996) Найырал ордени (2006)[5] Хүндүткел ордени (2015)[6].",tyv,Культура (Sous-catégorie),,https://tyv.wikipedia.org/?curid=8572,683,8572.0,['ru'],False,Культура,Sous-catégorie
,Пианист (кино),"Пианист (англ. The Pianist) - Роман Поланскиниң француз-немец-англий-поляк төөгүзү, драма кино. «Оскар» деп шаңналды ""тергиин актернуң оюну"" болгаш ""тергиин режиссура"" дээш алган. == Сюжеди == Кино болза Холокост үезинде Польшаның эң тергиин пианистериниң бирээзиниң, Владислав Шпильман дээр еврейниң, төөгүзүн үнелээн. Кол маадыры - Владех Шпильманны (англ. Vladeckh Spilman) өг-бүлези-биле Варшавада геттоже өске еврейлер-биле чурттадып каар. Ында оларны соп-эттеп, караан шарып турар. Үе эрткенде шупту геттода турар еврейлерни концлагерьже чоргузуптар. Владехти ооң немец эжи камгалап каар. Оон Владехтиң чуртталгазы өскерлий бээр: ону кым-даа камгалап турар, оон совет армия Варшаваны хостап эгелээр... == Актерлары == Эдриен Броуди - Владислав Шпильман. Томас Кречманн - Вильм Хозенфельд. Фрэнк Финлей - Владтың адазы. Маврин Липман - Владтың авазы. Ронан Виберт - Анджей Богуцкий. Эмилия Фокс - Дорота. Джессика Кейт - Галина. Юлия Райнер - Регина. Рой Смайлс - Идзак Хеллер. Збигнев Замаховский - клиентизи. Катаржина Фигура - кожазы. Зофья Червинская - суптуг хережээн. Михал Жебровский - Юрек. Борис Шиц - гестаповец. Эд Стоппард - Генрик. == Солун фактылар == Кинода Себастьян Бах, Фридерих Шопен, Любвиг Ван Бетховенниң аялгалары бар. == Кинодан сөстер == - Немецтер еврей туалеттерже кирбес, чүге дизе ында оларга эмин эрттир арыг (орус. Немцы не заходят в еврейские туалеты. Там для них слишком чисто). - Мен сени Чаа Чыл таварыштыр эттеп тур мен (орус. Я бью тебя по случаю Нового года). - Чем үеден хөй ажыктыг (орус. Еда важнее времени) - Бир эвес бистерни кезиптер болза, бистер ханзыраар бис бе. Бир эвес бистерни кичигелептер болза, бистер каттырбас бис бе. Бир эвес бистерни хораннаптар болза, бистер өлүп калбас бис бе. Бир эвес бистерни хомудадыптар болза, бистер өжээнин негевес бис бе? - Эжикти соктаар болза, соңгадан шуравыт (орус. Если стукнут в дверь, выбросись из окна). == Шөлүглер == Официальный сайт фильма Владислав Шпильман. Пианист. Варшавские дневники 1939-1945 гг. (2003), ISBN 5-93273-129-X",tyv,Культура (Sous-catégorie),,https://tyv.wikipedia.org/?curid=688,297,688.0,['ru'],False,Культура,Sous-catégorie
,Далай Ламаларның Намдарындан,"Далай Ламаларның Намдарындан. ""Төвүт дээрге-ле Далай лама, Далай лама дээрге-ле Төвүт"" деп чугаа бар. Ынчаарга чүгле чаңгыс төвүт улус ынча дивес боор. Бистиң моолдарда болза, Далай лама база бедик хүндүткелдиг, шажынныы-биле болза, Башкы дижиривис төөгүде бижиттинген. ""Далай лама"" дээр ат болза, Хувилай хаан үезинден нептереп эгелээн дижирлер бар. Ынчалза-даа төвүттер ном сургаалын бүгү Моолдуң шыны болдурар хүлээлгени күүсеткен Сономгаяцо, бистиң моолдарның адаарывыс-биле Сономжамц ламаның жамц дээр сөзү далай дээн уткалыг болгаш Сономжамц-биле ужурашкаш, Алдын хаан ону далай дег эртемниг лама чүве дээни-биле Далай лама дижи бергени чадавас. Оон аңгыда Хувилай ийикпе, Алдын хаанның ону Далай лама деп адаар дээр дугайында чарлыы амдыыга дээр тывылбаанын демдеглеп турарлар бар. Ам Далай лама дээр моол сөстү төвүттер Гэгээн башкы, Богда гэгээн, Дээдизи деп билип тайылбырлаар болу берген. Далай лама деп ат эң баштай моолга алдаржааш, оон улаштыр кыдаттарның ол атты ажыглааны Чөөн чүкке тарап, Европа, Америка дептерге четкен. Амгы делегей ону ниитизи-биле Далай лама деп адаар болу берген. Харын төвүттер аразында Далай лама деп чугаалашпас, Кундун азы сорулганың дээдизи, Ий-Шин-Норбу азы күзел боттандырыкчы ховар шын-дамал эртине, Гял-ва Ринбочи азы Эртинелиг Башкы дижип турар. Далай Лама дээр алдарны үш дугаар Далай лама четтирген болгаш ооң мурнундагы ийи кижини сөөлүнде Далай лама деп алдаржытканы төөгүден билдинип турар. == Дөзү == "" К.К.Кудажы, Ю.Ш.Кюнзегеш. Улуг-Хем: Тыва чогаалчыларның сеткүүлү 5-6. Доржготов ""Судур"". 1993 чыл.""",tyv,Культура (Sous-catégorie),,https://tyv.wikipedia.org/?curid=173,217,173.0,['ru'],False,Культура,Sous-catégorie
,Бурган-Даа,"Бурган-Даа (өскээр адаары Бурган Даа, Богда Даа, Будда Даа; орус. Гора Будды) - Тываның Чаа-Хөл кожуунда Сүме-Бели деп дагда куй иштинде Авыдай Бурганның болгаш ийи бурганнарның дүрзүзүн хевирлеп каан ыдыктыг чер. == Туружу == Чаа-Хөл кожууннуң девискээринде Сүме-Бели дагның үстүү бажында улуг куй иштинде хевирлеп чуруттунган. Ол болза Саян-Шушенск ГЭС-тиң суг-хөлбээниң (далайының) көдүрлүп кээнинниң девискээринге хамааржыр: тос ай (июнь-март) иштинде суг деңнелиниң адаанга баар, арткан үш айда (апрель-июнь) ""далайның"" суунуң деңнелиниң батканы-биле көстүп кээр. == Төөгүзү == «Тываның төөгүзү» деп номда ол куйну болгаш ыдыктыг чурумалды XII-XIII чүс чылдарда кылган деп демдеглээн. А Тыва АСРЭ-ниң сайыттар Чөвүлелиниң 1977 чылда Дужаалы-биле «Куйда ыдык чурук (XI-XIII вектер)» деп адаттынган. 1921 чылда Тыва Арат Республика хувискаалдыг ССРЭ биле Моол күрүнелерни өттүнүп сарыг шажын чүдүлгезин күрүне херээнден аңгылап, хуулгаазын хоралыг чүүлдер кылдыр демдеглээн. Ынчан, 1930 чылдардан эгелеп, Тываның хүрээ-хииттерин узуткап, лама-башкыларны дорамчылап, оларны бъак көрүп, чамдыктарын тудуп хоругдап-даа турган. Ынчалза-даа тыва чон, ылаңгыя Чаа-Хөл, Улуг-Хем чону Сүме даанда Ыдыктыг Будда Бурганынга дөмей-ле тейлеп чораан. XX чүс чылдың сөөлзүредир Саян-Шушенск ГЭС-тиң тудуу доозулган соонда, Чаа-Хөл болгаш Улуг-Хем кожууннарының эң эки тарылга кылыр, сиген кезер болгаш одар-белчиир шөлдери ""далай"" адаанче кире берген - эң бедик черинде 240 метр болган. Ынчалдыр Бурган-Даа база суг адаанда барган. Ынчалдыр үе аайы-биле далайдан үнүп-кирип турар апарган. == Тургузуу == Ортузунда Авыдай Бурган турар. Чанында турар ийи дүрзү - Авалокитешвара (төв. Ченрезиг) биле Махастхамапрапта (төв. Тхучентхув) бодхисаттвалар. А эжииниң бертинде турар ийи локапал дүрзүлери - Авыдай Бурганның оң талазында Вирудхаки (мурнуу чүктүң камгалакчызы) турар, солагай талазында Вирупаксы (барыын чүктүң камагалакчызы) турар. == Дөзүк == Ном. Кара-оол В.Х. ""Ыдык күштүг Будда Бурган"". 2013ч., Ю.Ш. Күнзегеш аттыг Тываның ном үндүрер чери, 308 ар.",tyv,Культура (Sous-catégorie),,https://tyv.wikipedia.org/?curid=1574,273,1574.0,['ru'],False,Культура,Sous-catégorie
,Парамита,"Парамита Парамита (санскр. पारमिता, pāramitā IAST, кит. упр. 波羅蜜多, палл.: Боломидо) - ""дээди деңнел"" деп тыва дылче очулдурар. Парамита дээрге бирги биле ийиги алыс шыннарны узуткаарынга азы хосталга чедип алырынга ажыктыг алды сырый харылзаалыг күштер дээн. Парамита деп сөстүң утказы хосталга чедире бээр хөделиишкин деп база болур. Сарыг Шажында 6 парамита: 1. Экииргек сеткил парамитазы (щедрость) - кандыг-даа байдалга дузаны кадып билири болур.Экииргек сеткил материалдыг тала-биле, өөрүшкү-биле, эртем-билиг-биле болгаш оон-даа аңгы деңнелге дузалаары. Өөредиг бээри экииргек сеткилдиң эң-не буянныг талазы болур. 2. Мөзү-шынар парамитазы (нравственность) - дээрге медерелдиг чурттаары болгаш бодуңга болгаш өскелерге ажыктыг болуру. Мага-бот, аас-дыл болгаш угааны-биле нүгүл кылырындан ойталаары болгаш буян чыырынга идекпейлии. 3. Шыдамык сеткил - дээрге чыып алган буянын кылык-килеңге өртетпези болур. Ол болза кандыг-даа харыы берип шыдавазы эвес, а идекпейлиг болза-даа кылык-килең чокка кылыры. 4. Кызымакай сеткил - дээрге бодунуң тура-соруу күштүг, могаг-шылаг чокка амыдыралчызы. Салган сорулгазынче чалгаа болбайн, ойталаашкын чокка күженип, саарыгның саарлааны-дег үзүктел чок хөделип тургаш салган сорулгазын чедип алырын ынча дээр. 5. Даяннаары - Угаанның агымын кыдыындан хайгаараары азы болза кандыг бир сайгарылганы аңгы-аңгы талалар биле чүгле угаан медерелин аңыглап тургаш сайгарары. 6) Мерген-угаан - угаанның шын бойдус тодарадылгазын билгеш бүгү чүвени тода частырыг чокка медерээри.",tyv,Культура (Sous-catégorie),,https://tyv.wikipedia.org/?curid=60,195,60.0,['ru'],False,Культура,Sous-catégorie
,Ногаан Дарийги – Дрөлжаң,"Ногаан Дарийги - Дрөлжаң - Ногаан Дарийгини бүгү-ле амылыгларның авазы кылдыр хүлээп турар. Чүге дээрге ол амылыгларның дөгерезинге, бодунуң төлүнге дег, ынак, Улуг Энерелдиг. Ол Будда Бурганның идекпейиниң илерели, чаяалгазы (аспект активности Будды). Ногаан Дарийги бөдүүн херээжен кижи дурган. Сарыг Шажынның Өөредиин шиңгээдип, боттандырып чорааш, Чырыткылыг Будда Деңнелинге четкен. “Бүгү-ле амылыглар шуптузу Чырыткылыг байдалга четпээн шаанда, Чыргалаңче чорбас мен” - деп даңгыраглаан. Оон эгелээш, амылыгларга кезээде дузалап чоруур. Ооң эң кол шынары: дүрген дуза херек байдалда дузаны албан чедирип чорууру. Ооң бир буду олудундан шала бадып келген дээрге-ле “дуза хереглээн амылыгларынга дораан дузалаайн” деп даңгырак бергенин демдеглеп турар. Ногаан Дарийгиниң тариназы чуртталгада шаптараазыннарны арыглаар, каргыш-чатка, багай дүштерден камгалаар. == Тариназы == ОМ ТАРЕ ТУТАРЕ ТУРЕ СОХА == Дөзүк == Геше Лобсаң (Ловзаң) Тхүптен. ""Будда Бурганга сүзүглеп тейлээри база хилинчек-човулаңдан адырлырының аргалары"". Тыва дылда. Кызыл: ""Тываның ном үндүрер чери"", 2008 - 93 а.",tyv,Культура (Sous-catégorie),,https://tyv.wikipedia.org/?curid=3050,142,3050.0,['ru'],False,Культура,Sous-catégorie
